0000 Ether / IP / TCP 100.0.0.45:54069 > 100.0.0.40:http A
0001 Ether / IP / TCP 100.0.0.45:54069 > 100.0.0.40:http A
0002 Ether / IP / TCP 100.0.0.45:54069 > 100.0.0.40:http FA
0003 Ether / IP / TCP 100.0.0.40:http > 100.0.0.45:54069 A
0004 Ether / ARP who has 100.0.0.41 says 100.0.0.45
0005 Ether / ARP is at 00:00:00:00:00:09 says 100.0.0.41
0006 Ether / ARP who has 100.0.0.41 says 100.0.0.45
0007 Ether / IP / TCP 100.0.0.45:54070 > 100.0.0.41:http S
0008 Ether / IP / TCP 100.0.0.45:54070 > 100.0.0.41:http S
0009 Ether / ARP is at 00:00:00:00:00:09 says 100.0.0.41
0010 Ether / IP / TCP 100.0.0.41:http > 100.0.0.45:54070 SA
0011 Ether / IP / TCP 100.0.0.41:http > 100.0.0.45:54070 SA
0012 Ether / IP / TCP 100.0.0.41:http > 100.0.0.45:54070 SA
0013 Ether / IP / TCP 100.0.0.45:54070 > 100.0.0.41:http S
0014 Ether / IP / TCP 100.0.0.41:http > 100.0.0.45:54070 SA
0015 Ether / IP / TCP 100.0.0.41:http > 100.0.0.45:54070 SA
0016 Ether / IP / TCP 100.0.0.45:54070 > 100.0.0.41:http S
0017 Ether / IP / TCP 100.0.0.41:http > 100.0.0.45:54070 SA
0018 Ether / ARP who has 100.0.0.45 says 100.0.0.41
0019 Ether / ARP who has 100.0.0.45 says 100.0.0.41
0020 Ether / ARP is at 26:bb:04:96:4b:eb says 100.0.0.45
0021 Ether / IP / TCP 100.0.0.45:54070 > 100.0.0.41:http A
0022 Ether / IP / TCP 100.0.0.45:54070 > 100.0.0.41:http PA / Raw
0023 Ether / IP / TCP 100.0.0.41:http > 100.0.0.45:54070 A
0024 Ether / IP / TCP 100.0.0.45:54070 > 100.0.0.41:http A
0025 Ether / IP / TCP 100.0.0.41:http > 100.0.0.45:54070 PA / Raw
0026 Ether / IP / TCP 100.0.0.41:http > 100.0.0.45:54070 FPA / Raw
0027 Ether / IP / TCP 100.0.0.41:http > 100.0.0.45:54070 FPA / Raw
0028 Ether / ARP is at 26:bb:04:96:4b:eb says 100.0.0.45
0029 Ether / IP / TCP 100.0.0.45:54070 > 100.0.0.41:http A
0030 Ether / IP / TCP 100.0.0.45:54070 > 100.0.0.41:http A
0031 Ether / IP / TCP 100.0.0.45:54070 > 100.0.0.41:http A
0032 Ether / IP / TCP 100.0.0.45:54070 > 100.0.0.41:http A
0033 Ether / IP / TCP 100.0.0.45:54070 > 100.0.0.41:http A
0034 Ether / IP / TCP 100.0.0.45:54070 > 100.0.0.41:http FA
0035 Ether / IP / TCP 100.0.0.41:http > 100.0.0.45:54070 A
0036 Ether / ARP who has 100.0.0.42 says 100.0.0.45
0037 Ether / ARP is at 00:00:00:00:00:0a says 100.0.0.42
0038 Ether / ARP who has 100.0.0.42 says 100.0.0.45
0039 Ether / IP / TCP 100.0.0.45:54071 > 100.0.0.42:http S
0040 Ether / IP / TCP 100.0.0.45:54071 > 100.0.0.42:http S
0041 Ether / IP / TCP 100.0.0.42:http > 100.0.0.45:54071 SA
0042 Ether / IP / TCP 100.0.0.42:http > 100.0.0.45:54071 SA
0043 Ether / ARP is at 00:00:00:00:00:0a says 100.0.0.42
0044 Ether / IP / TCP 100.0.0.42:http > 100.0.0.45:54071 SA
0045 Ether / IP / TCP 100.0.0.42:http > 100.0.0.45:54071 SA
0046 Ether / ARP who has 100.0.0.45 says 100.0.0.42
0047 Ether / ARP who has 100.0.0.45 says 100.0.0.42
0048 Ether / IP / TCP 100.0.0.45:54071 > 100.0.0.42:http A
0049 Ether / ARP is at 26:bb:04:96:4b:eb says 100.0.0.45
0050 Ether / IP / TCP 100.0.0.45:54071 > 100.0.0.42:http PA / Raw
0051 Ether / IP / TCP 100.0.0.45:54071 > 100.0.0.42:http A
0052 Ether / IP / TCP 100.0.0.42:http > 100.0.0.45:54071 A
0053 Ether / IP / TCP 100.0.0.42:http > 100.0.0.45:54071 PA / Raw
0054 Ether / IP / TCP 100.0.0.42:http > 100.0.0.45:54071 FPA / Raw
0055 Ether / IP / TCP 100.0.0.42:http > 100.0.0.45:54071 FPA / Raw
0056 Ether / ARP is at 26:bb:04:96:4b:eb says 100.0.0.45
0057 Ether / IP / TCP 100.0.0.45:54071 > 100.0.0.42:http A
0058 Ether / ARP who has 100.0.0.42 says 100.0.0.45
0059 Ether / IP / TCP 100.0.0.45:54071 > 100.0.0.42:http FA
0060 Ether / IP / TCP 100.0.0.42:http > 100.0.0.45:54071 A
0061 Ether / ARP is at 00:00:00:00:00:0a says 100.0.0.42
0062 Ether / ARP who has 100.0.0.40 says 100.0.0.45
0063 Ether / IP / TCP 100.0.0.45:54072 > 100.0.0.40:http S
0064 Ether / ARP is at 00:00:00:00:00:08 says 100.0.0.40
0065 Ether / IP / TCP 100.0.0.40:http > 100.0.0.45:54072 SA
0066 Ether / IP / TCP 100.0.0.40:http > 100.0.0.45:54072 SA
0067 Ether / ARP who has 100.0.0.40 says 100.0.0.45
0068 Ether / IP / TCP 100.0.0.45:54072 > 100.0.0.40:http S
0069 Ether / ARP is at 00:00:00:00:00:08 says 100.0.0.40
0070 Ether / IP / TCP 100.0.0.40:http > 100.0.0.45:54072 SA
0071 Ether / IP / TCP 100.0.0.40:http > 100.0.0.45:54072 SA
0072 Ether / IP / TCP 100.0.0.45:54072 > 100.0.0.40:http S
0073 Ether / IP / TCP 100.0.0.40:http > 100.0.0.45:54072 SA
0074 Ether / IP / TCP 100.0.0.40:http > 100.0.0.45:54072 SA
0075 Ether / ARP who has 100.0.0.45 says 100.0.0.40
0076 Ether / IP / TCP 100.0.0.45:54072 > 100.0.0.40:http A
0077 Ether / IP / TCP 100.0.0.45:54072 > 100.0.0.40:http PA / Raw
0078 Ether / IP / TCP 100.0.0.40:http > 100.0.0.45:54072 A
0079 Ether / IP / TCP 100.0.0.40:http > 100.0.0.45:54072 PA / Raw
0080 Ether / IP / TCP 100.0.0.40:http > 100.0.0.45:54072 FPA / Raw
0081 Ether / ARP who has 100.0.0.45 says 100.0.0.40
0082 Ether / IP / TCP 100.0.0.45:54072 > 100.0.0.40:http A
0083 Ether / ARP is at 26:bb:04:96:4b:eb says 100.0.0.45
0084 Ether / IP / TCP 100.0.0.45:54072 > 100.0.0.40:http A
0085 Ether / IP / TCP 100.0.0.45:54072 > 100.0.0.40:http A
0086 Ether / ARP is at 26:bb:04:96:4b:eb says 100.0.0.45
0087 Ether / IP / TCP 100.0.0.45:54072 > 100.0.0.40:http A
0088 Ether / IP / TCP 100.0.0.45:54072 > 100.0.0.40:http A
0089 Ether / IP / TCP 100.0.0.45:54072 > 100.0.0.40:http A
0090 Ether / IP / TCP 100.0.0.45:54072 > 100.0.0.40:http FA
0091 Ether / IP / TCP 100.0.0.40:http > 100.0.0.45:54072 A
0092 Ether / ARP who has 100.0.0.41 says 100.0.0.45
0093 Ether / IP / TCP 100.0.0.45:54073 > 100.0.0.41:http S
0094 Ether / IP / TCP 100.0.0.41:http > 100.0.0.45:54073 SA
0095 Ether / ARP is at 00:00:00:00:00:09 says 100.0.0.41
0096 Ether / IP / TCP 100.0.0.41:http > 100.0.0.45:54073 SA
0097 Ether / ARP who has 100.0.0.41 says 100.0.0.45
0098 Ether / IP / TCP 100.0.0.45:54073 > 100.0.0.41:http S
0099 Ether / IP / TCP 100.0.0.45:54073 > 100.0.0.41:http S
0100 Ether / IP / TCP 100.0.0.41:http > 100.0.0.45:54073 SA
0101 Ether / IP / TCP 100.0.0.41:http > 100.0.0.45:54073 SA
0102 Ether / ARP is at 00:00:00:00:00:09 says 100.0.0.41
0103 Ether / IP / TCP 100.0.0.41:http > 100.0.0.45:54073 SA
0104 Ether / ARP who has 100.0.0.45 says 100.0.0.41
0105 Ether / ARP who has 100.0.0.45 says 100.0.0.41
0106 Ether / IP / TCP 100.0.0.45:54073 > 100.0.0.41:http A
0107 Ether / ARP is at 26:bb:04:96:4b:eb says 100.0.0.45
0108 Ether / IP / TCP 100.0.0.45:54073 > 100.0.0.41:http PA / Raw
0109 Ether / IP / TCP 100.0.0.41:http > 100.0.0.45:54073 A
0110 Ether / IP / TCP 100.0.0.41:http > 100.0.0.45:54073 PA / Raw
0111 Ether / IP / TCP 100.0.0.41:http > 100.0.0.45:54073 FPA / Raw
0112 Ether / ARP is at 26:bb:04:96:4b:eb says 100.0.0.45
0113 Ether / IP / TCP 100.0.0.41:http > 100.0.0.45:54073 FPA / Raw
0114 Ether / IP / TCP 100.0.0.45:54073 > 100.0.0.41:http A
0115 Ether / ARP who has 100.0.0.42 says 100.0.0.45
0116 Ether / IP / TCP 100.0.0.45:54074 > 100.0.0.42:http S
0117 Ether / ARP is at 00:00:00:00:00:0a says 100.0.0.42
0118 Ether / IP / TCP 100.0.0.42:http > 100.0.0.45:54074 SA
0119 Ether / IP / TCP 100.0.0.42:http > 100.0.0.45:54074 SA
0120 Ether / ARP who has 100.0.0.42 says 100.0.0.45
0121 Ether / ARP is at 00:00:00:00:00:0a says 100.0.0.42
0122 Ether / IP / TCP 100.0.0.45:54074 > 100.0.0.42:http S
0123 Ether / IP / TCP 100.0.0.42:http > 100.0.0.45:54074 SA
0124 Ether / IP / TCP 100.0.0.42:http > 100.0.0.45:54074 SA
0125 Ether / IP / TCP 100.0.0.45:54074 > 100.0.0.42:http S
0126 Ether / IP / TCP 100.0.0.42:http > 100.0.0.45:54074 SA
0127 Ether / ARP who has 100.0.0.45 says 100.0.0.42
0128 Ether / ARP who has 100.0.0.45 says 100.0.0.42
0129 Ether / ARP is at 26:bb:04:96:4b:eb says 100.0.0.45
0130 Ether / IP / TCP 100.0.0.45:54074 > 100.0.0.42:http A
0131 Ether / IP / TCP 100.0.0.45:54074 > 100.0.0.42:http PA / Raw
0132 Ether / IP / TCP 100.0.0.42:http > 100.0.0.45:54074 A
0133 Ether / IP / TCP 100.0.0.42:http > 100.0.0.45:54074 PA / Raw
0134 Ether / IP / TCP 100.0.0.42:http > 100.0.0.45:54074 FPA / Raw
0135 Ether / ARP is at 26:bb:04:96:4b:eb says 100.0.0.45
0136 Ether / IP / TCP 100.0.0.45:54074 > 100.0.0.42:http A
0137 Ether / IP / TCP 100.0.0.45:54074 > 100.0.0.42:http A
0138 Ether / ARP who has 100.0.0.41 says 100.0.0.45
0139 Ether / IP / TCP 100.0.0.45:54073 > 100.0.0.41:http FA
0140 Ether / IP / TCP 100.0.0.45:54074 > 100.0.0.42:http A
0141 Ether / IP / TCP 100.0.0.45:54074 > 100.0.0.42:http A
0142 Ether / ARP is at 00:00:00:00:00:09 says 100.0.0.41
0143 Ether / IP / TCP 100.0.0.41:http > 100.0.0.45:54073 A
0144 Ether / IP / TCP 100.0.0.45:54074 > 100.0.0.42:http A
0145 Ether / IP / TCP 100.0.0.45:54074 > 100.0.0.42:http FA
0146 Ether / IP / TCP 100.0.0.42:http > 100.0.0.45:54074 A
0147 Ether / ARP who has 100.0.0.45 says 100.0.0.41
0148 Ether / ARP who has 100.0.0.45 says 100.0.0.41
0149 Ether / ARP is at 26:bb:04:96:4b:eb says 100.0.0.45
0150 Ether / ARP is at 26:bb:04:96:4b:eb says 100.0.0.45
0151 Ether / ARP who has 100.0.0.40 says 100.0.0.45
0152 Ether / IP / TCP 100.0.0.45:54075 > 100.0.0.40:http S
0153 Ether / ARP is at 00:00:00:00:00:08 says 100.0.0.40
0154 Ether / IP / TCP 100.0.0.40:http > 100.0.0.45:54075 SA
0155 Ether / IP / TCP 100.0.0.40:http > 100.0.0.45:54075 SA
0156 Ether / IP / TCP 100.0.0.40:http > 100.0.0.45:54075 SA
0157 Ether / ARP who has 100.0.0.45 says 100.0.0.40
0158 Ether / ARP who has 100.0.0.45 says 100.0.0.40
0159 Ether / IP / TCP 100.0.0.45:54075 > 100.0.0.40:http A
0160 Ether / ARP is at 26:bb:04:96:4b:eb says 100.0.0.45
0161 Ether / IP / TCP 100.0.0.45:54075 > 100.0.0.40:http PA / Raw
0162 Ether / IP / TCP 100.0.0.40:http > 100.0.0.45:54075 A
0163 Ether / IP / TCP 100.0.0.40:http > 100.0.0.45:54075 PA / Raw
0164 Ether / IP / TCP 100.0.0.40:http > 100.0.0.45:54075 FPA / Raw
0165 Ether / IP / TCP 100.0.0.40:http > 100.0.0.45:54075 FPA / Raw
0166 Ether / ARP is at 26:bb:04:96:4b:eb says 100.0.0.45
0167 Ether / IP / TCP 100.0.0.45:54075 > 100.0.0.40:http A
0168 Ether / ARP who has 100.0.0.41 says 100.0.0.45
0169 Ether / IP / TCP 100.0.0.45:54076 > 100.0.0.41:http S
0170 Ether / ARP is at 00:00:00:00:00:09 says 100.0.0.41
0171 Ether / IP / TCP 100.0.0.41:http > 100.0.0.45:54076 SA
0172 Ether / IP / TCP 100.0.0.41:http > 100.0.0.45:54076 SA
0173 Ether / ARP who has 100.0.0.41 says 100.0.0.45
0174 Ether / ARP is at 00:00:00:00:00:09 says 100.0.0.41
0175 Ether / IP / TCP 100.0.0.45:54076 > 100.0.0.41:http S
0176 Ether / IP / TCP 100.0.0.41:http > 100.0.0.45:54076 SA
0177 Ether / IP / TCP 100.0.0.41:http > 100.0.0.45:54076 SA
0178 Ether / IP / TCP 100.0.0.45:54076 > 100.0.0.41:http S
0179 Ether / IP / TCP 100.0.0.41:http > 100.0.0.45:54076 SA
0180 Ether / ARP who has 100.0.0.45 says 100.0.0.41
0181 Ether / ARP who has 100.0.0.45 says 100.0.0.41
0182 Ether / IP / TCP 100.0.0.45:54076 > 100.0.0.41:http A
0183 Ether / ARP is at 26:bb:04:96:4b:eb says 100.0.0.45
0184 Ether / IP / TCP 100.0.0.45:54076 > 100.0.0.41:http PA / Raw
0185 Ether / IP / TCP 100.0.0.41:http > 100.0.0.45:54076 A
0186 Ether / IP / TCP 100.0.0.41:http > 100.0.0.45:54076 PA / Raw
0187 Ether / IP / TCP 100.0.0.41:http > 100.0.0.45:54076 FPA / Raw
0188 Ether / ARP is at 26:bb:04:96:4b:eb says 100.0.0.45
0189 Ether / IP / TCP 100.0.0.40:http > 100.0.0.45:54075 FPA / Raw
0190 Ether / IP / TCP 100.0.0.45:54076 > 100.0.0.41:http A
0191 Ether / IP / TCP 100.0.0.45:54076 > 100.0.0.41:http A
0192 Ether / IP / TCP 100.0.0.45:54076 > 100.0.0.41:http A
0193 Ether / IP / TCP 100.0.0.45:54076 > 100.0.0.41:http A
0194 Ether / IP / TCP 100.0.0.45:54076 > 100.0.0.41:http A
0195 Ether / IP / TCP 100.0.0.45:54076 > 100.0.0.41:http FA
0196 Ether / IP / TCP 100.0.0.41:http > 100.0.0.45:54076 A
0197 Ether / ARP who has 100.0.0.45 says 100.0.0.40
0198 Ether / ARP who has 100.0.0.40 says 100.0.0.45
0199 Ether / IP / TCP 100.0.0.45:54075 > 100.0.0.40:http A
0200 Ether / ARP is at 00:00:00:00:00:08 says 100.0.0.40
0201 Ether / ARP is at 26:bb:04:96:4b:eb says 100.0.0.45
0202 Ether / ARP who has 100.0.0.42 says 100.0.0.45
0203 Ether / IP / TCP 100.0.0.45:54077 > 100.0.0.42:http S
0204 Ether / IP / TCP 100.0.0.42:http > 100.0.0.45:54077 SA
0205 Ether / ARP is at 00:00:00:00:00:0a says 100.0.0.42
0206 Ether / IP / TCP 100.0.0.42:http > 100.0.0.45:54077 SA
0207 Ether / IP / TCP 100.0.0.42:http > 100.0.0.45:54077 SA
0208 Ether / ARP who has 100.0.0.45 says 100.0.0.42
0209 Ether / ARP who has 100.0.0.45 says 100.0.0.42
0210 Ether / IP / TCP 100.0.0.45:54077 > 100.0.0.42:http A
0211 Ether / ARP is at 26:bb:04:96:4b:eb says 100.0.0.45
0212 Ether / IP / TCP 100.0.0.45:54077 > 100.0.0.42:http PA / Raw
0213 Ether / IP / TCP 100.0.0.42:http > 100.0.0.45:54077 A
0214 Ether / IP / TCP 100.0.0.42:http > 100.0.0.45:54077 PA / Raw
0215 Ether / IP / TCP 100.0.0.42:http > 100.0.0.45:54077 FPA / Raw
0216 Ether / IP / TCP 100.0.0.42:http > 100.0.0.45:54077 FPA / Raw
0217 Ether / ARP is at 26:bb:04:96:4b:eb says 100.0.0.45
