0022 Ether / IP / TCP 100.0.0.45:54070 > 100.0.0.41:http PA / Raw
0050 Ether / IP / TCP 100.0.0.45:54071 > 100.0.0.42:http PA / Raw
0077 Ether / IP / TCP 100.0.0.45:54072 > 100.0.0.40:http PA / Raw
0108 Ether / IP / TCP 100.0.0.45:54073 > 100.0.0.41:http PA / Raw
0131 Ether / IP / TCP 100.0.0.45:54074 > 100.0.0.42:http PA / Raw
0161 Ether / IP / TCP 100.0.0.45:54075 > 100.0.0.40:http PA / Raw
0184 Ether / IP / TCP 100.0.0.45:54076 > 100.0.0.41:http PA / Raw
0212 Ether / IP / TCP 100.0.0.45:54077 > 100.0.0.42:http PA / Raw
